[
  {
    "id": "chatgpt",
    "name": "ChatGPT",
    "url": "https://chat.openai.com",
    "category": "text-generation",
    "description": "Conversational AI by OpenAI. Answers questions, writes content, codes, and assists with various tasks.",
    "pricing": "freemium",
    "tags": [
      "chatbot",
      "writing",
      "coding",
      "reasoning"
    ],
    "featured": true,
    "premium": false,
    "logoUrl": "https://cdn.oaistatic.com/_next/static/media/apple-touch-icon.59f2e898.png",
    "addedAt": "2026-02-10"
  },
  {
    "id": "claude",
    "name": "Claude",
    "url": "https://claude.ai",
    "category": "text-generation",
    "description": "Anthropic's AI assistant. Excels at analysis, coding, writing, and complex reasoning tasks.",
    "pricing": "freemium",
    "tags": [
      "chatbot",
      "coding",
      "analysis",
      "long-context"
    ],
    "featured": true,
    "premium": false,
    "logoUrl": "https://claude.ai/favicon.ico",
    "addedAt": "2026-02-10"
  },
  {
    "id": "midjourney",
    "name": "Midjourney",
    "url": "https://midjourney.com",
    "category": "image-generation",
    "description": "AI image generator creating stunning, artistic visuals from text prompts via Discord.",
    "pricing": "paid",
    "tags": [
      "art",
      "design",
      "discord",
      "high-quality"
    ],
    "featured": true,
    "premium": false,
    "logoUrl": "https://midjourney.com/apple-touch-icon.png",
    "addedAt": "2026-02-10"
  },
  {
    "id": "dall-e",
    "name": "DALL-E 3",
    "url": "https://openai.com/dall-e-3",
    "category": "image-generation",
    "description": "OpenAI's image generator. Creates detailed images from text descriptions with high accuracy.",
    "pricing": "paid",
    "tags": [
      "art",
      "design",
      "openai"
    ],
    "featured": true,
    "premium": false,
    "logoUrl": "https://openai.com/favicon.ico",
    "addedAt": "2026-02-10"
  },
  {
    "id": "gemini",
    "name": "Gemini",
    "url": "https://gemini.google.com",
    "category": "text-generation",
    "description": "Google's multimodal AI. Understands text, images, audio, video, and code.",
    "pricing": "freemium",
    "tags": [
      "chatbot",
      "multimodal",
      "google",
      "search"
    ],
    "featured": true,
    "premium": false,
    "logoUrl": "https://www.gstatic.com/lamda/images/gemini_sparkle_v002_d4735304ff6292a690345.svg",
    "addedAt": "2026-02-10"
  },
  {
    "id": "github-copilot",
    "name": "GitHub Copilot",
    "url": "https://github.com/features/copilot",
    "category": "code-development",
    "description": "AI pair programmer by GitHub and OpenAI. Code suggestions in your IDE.",
    "pricing": "paid",
    "tags": [
      "coding",
      "vscode",
      "github",
      "autocomplete"
    ],
    "featured": true,
    "premium": false,
    "logoUrl": "https://github.githubassets.com/favicons/favicon.svg",
    "addedAt": "2026-02-10"
  },
  {
    "id": "cursor",
    "name": "Cursor",
    "url": "https://cursor.sh",
    "category": "code-development",
    "description": "AI-first code editor. Built on VSCode with powerful AI assistance and chat.",
    "pricing": "freemium",
    "tags": [
      "coding",
      "ide",
      "vscode-fork",
      "ai-native"
    ],
    "featured": true,
    "premium": false,
    "logoUrl": "https://cursor.sh/favicon.ico",
    "addedAt": "2026-02-10"
  },
  {
    "id": "stable-diffusion",
    "name": "Stable Diffusion",
    "url": "https://stability.ai",
    "category": "image-generation",
    "description": "Open-source image generation model. Run locally or via cloud services.",
    "pricing": "open-source",
    "tags": [
      "art",
      "open-source",
      "local",
      "customizable"
    ],
    "featured": false,
    "premium": false,
    "logoUrl": "https://stability.ai/favicon.ico",
    "addedAt": "2026-02-10"
  },
  {
    "id": "runway",
    "name": "Runway",
    "url": "https://runwayml.com",
    "category": "video-generation",
    "description": "AI video editor and generator. Create, edit, and enhance videos with AI tools.",
    "pricing": "freemium",
    "tags": [
      "video",
      "editing",
      "generation",
      "creative"
    ],
    "featured": true,
    "premium": false,
    "logoUrl": "https://runwayml.com/favicon.ico",
    "addedAt": "2026-02-10"
  },
  {
    "id": "elevenlabs",
    "name": "ElevenLabs",
    "url": "https://elevenlabs.io",
    "category": "audio-music",
    "description": "AI voice synthesis and cloning. Natural, expressive speech in multiple languages.",
    "pricing": "freemium",
    "tags": [
      "voice",
      "tts",
      "voice-cloning",
      "multilingual"
    ],
    "featured": true,
    "premium": false,
    "logoUrl": "https://elevenlabs.io/favicon.ico",
    "addedAt": "2026-02-10"
  },
  {
    "id": "synthesia",
    "name": "Synthesia",
    "url": "https://synthesia.io",
    "category": "video-generation",
    "description": "AI video platform. Create videos with AI avatars from text scripts.",
    "pricing": "paid",
    "tags": [
      "video",
      "avatars",
      "training",
      "corporate"
    ],
    "featured": false,
    "premium": false,
    "logoUrl": "https://synthesia.io/favicon.ico",
    "addedAt": "2026-02-10"
  },
  {
    "id": "jasper",
    "name": "Jasper",
    "url": "https://jasper.ai",
    "category": "marketing-sales",
    "description": "AI content platform for marketing teams. Generate blog posts, ads, social content.",
    "pricing": "paid",
    "tags": [
      "marketing",
      "content",
      "copywriting",
      "seo"
    ],
    "featured": false,
    "premium": false,
    "logoUrl": "https://jasper.ai/favicon.ico",
    "addedAt": "2026-02-10"
  },
  {
    "id": "copyai",
    "name": "Copy.ai",
    "url": "https://copy.ai",
    "category": "marketing-sales",
    "description": "AI copywriter for marketing. Blog posts, emails, social media, and more.",
    "pricing": "freemium",
    "tags": [
      "marketing",
      "copywriting",
      "automation"
    ],
    "featured": false,
    "premium": false,
    "logoUrl": "https://copy.ai/favicon.ico",
    "addedAt": "2026-02-10"
  },
  {
    "id": "notion-ai",
    "name": "Notion AI",
    "url": "https://notion.so/product/ai",
    "category": "productivity",
    "description": "AI assistant built into Notion. Write, summarize, brainstorm, and organize.",
    "pricing": "paid",
    "tags": [
      "productivity",
      "notes",
      "writing",
      "workspace"
    ],
    "featured": false,
    "premium": false,
    "logoUrl": "https://notion.so/favicon.ico",
    "addedAt": "2026-02-10"
  },
  {
    "id": "grammarly",
    "name": "Grammarly",
    "url": "https://grammarly.com",
    "category": "productivity",
    "description": "AI writing assistant. Grammar, spelling, tone, clarity suggestions across apps.",
    "pricing": "freemium",
    "tags": [
      "writing",
      "grammar",
      "editing",
      "browser-extension"
    ],
    "featured": false,
    "premium": false,
    "logoUrl": "https://grammarly.com/favicon.ico",
    "addedAt": "2026-02-10"
  },
  {
    "id": "canva-ai",
    "name": "Canva AI",
    "url": "https://canva.com",
    "category": "design-creative",
    "description": "Graphic design platform with AI tools. Text-to-image, Magic Edit, templates.",
    "pricing": "freemium",
    "tags": [
      "design",
      "graphics",
      "templates",
      "easy"
    ],
    "featured": false,
    "premium": false,
    "logoUrl": "https://canva.com/favicon.ico",
    "addedAt": "2026-02-10"
  },
  {
    "id": "descript",
    "name": "Descript",
    "url": "https://descript.com",
    "category": "audio-music",
    "description": "Audio/video editor with AI transcription, voice cloning, and Studio Sound.",
    "pricing": "freemium",
    "tags": [
      "audio",
      "video",
      "transcription",
      "podcasting"
    ],
    "featured": false,
    "premium": false,
    "logoUrl": "https://descript.com/favicon.ico",
    "addedAt": "2026-02-10"
  },
  {
    "id": "perplexity",
    "name": "Perplexity AI",
    "url": "https://perplexity.ai",
    "category": "research-education",
    "description": "AI-powered search engine. Answers with sources and citations in real-time.",
    "pricing": "freemium",
    "tags": [
      "search",
      "research",
      "citations",
      "real-time"
    ],
    "featured": true,
    "premium": false,
    "logoUrl": "https://perplexity.ai/favicon.ico",
    "addedAt": "2026-02-10"
  },
  {
    "id": "v0-dev",
    "name": "v0.dev",
    "url": "https://v0.dev",
    "category": "code-development",
    "description": "Vercel's AI UI generator. Generate React components from text descriptions.",
    "pricing": "freemium",
    "tags": [
      "coding",
      "react",
      "ui",
      "vercel"
    ],
    "featured": false,
    "premium": false,
    "logoUrl": "https://v0.dev/favicon.ico",
    "addedAt": "2026-02-10"
  },
  {
    "id": "claude-code",
    "name": "Claude Code",
    "url": "https://claude.ai",
    "category": "code-development",
    "description": "Anthropic's coding assistant. Edit codebases, debug, and build features.",
    "pricing": "freemium",
    "tags": [
      "coding",
      "cli",
      "agent",
      "autonomous"
    ],
    "featured": false,
    "premium": false,
    "logoUrl": "https://claude.ai/favicon.ico",
    "addedAt": "2026-02-10"
  },
  {
    "id": "suno",
    "name": "Suno",
    "url": "https://suno.ai",
    "category": "audio-music",
    "description": "AI music generator. Create full songs from text prompts with vocals and instruments.",
    "pricing": "freemium",
    "tags": [
      "music",
      "generation",
      "vocals",
      "production"
    ],
    "featured": true,
    "premium": false,
    "logoUrl": "https://suno.ai/favicon.ico",
    "addedAt": "2026-02-10"
  },
  {
    "id": "udio",
    "name": "Udio",
    "url": "https://udio.com",
    "category": "audio-music",